{
  "$schema": "https://json-schema.org/draft/2020-12/schema",
  "$id": "https://release-control.arconath.com/contracts/product-policy.schema.json",
  "title": "Arconath product artifact policy",
  "type": "object",
  "additionalProperties": false,
  "required": [
    "schema_version",
    "policy_id",
    "enabled",
    "source_repository",
    "registry_host",
    "artifact_repository",
    "max_intent_age_seconds",
    "build",
    "verification_commands"
  ],
  "properties": {
    "schema_version": {"const": 1},
    "policy_id": {"type": "string", "pattern": "^[a-z0-9][a-z0-9-]{1,62}$"},
    "enabled": {"type": "boolean"},
    "source_repository": {"type": "string", "pattern": "^Arconath/[a-z0-9][a-z0-9-]{1,99}$"},
    "registry_host": {"type": "string", "pattern": "^[a-z0-9.-]+(?::[1-9][0-9]{0,4})?$"},
    "artifact_repository": {"type": "string", "pattern": "^[a-z0-9.-]+(?::[1-9][0-9]{0,4})?(?:/[a-z0-9][a-z0-9._-]*)+$"},
    "max_intent_age_seconds": {"type": "integer", "minimum": 300, "maximum": 604800},
    "build": {
      "type": "object",
      "additionalProperties": false,
      "required": ["context", "dockerfile", "platform"],
      "properties": {
        "context": {"type": "string"},
        "dockerfile": {"type": "string"},
        "platform": {"enum": ["linux/amd64", "linux/arm64"]}
      }
    },
    "verification_commands": {
      "type": "array",
      "minItems": 1,
      "items": {
        "type": "array",
        "minItems": 1,
        "items": {"type": "string", "minLength": 1}
      }
    }
  }
}
