{"artifact_repository":"ghcr.io/arconath/boringkit-worker","build":{"context":".","dockerfile":"docker/worker.Dockerfile","platform":"linux/amd64"},"enabled":true,"max_intent_age_seconds":86400,"policy_id":"boringkit-worker","registry_host":"ghcr.io","schema_version":1,"source_repository":"Arconath/boringkit","verification_commands":[["bash","scripts/ci/validate.sh","pr"]]}
